matmul.log
{"input": ["cuda -keys=cuda,gpu -max_num_threads=1024 -thread_warp_size=32", "logsummul", ["float32"], {}], "config": {"index": 166, "code_hash": null, "entity": [["y_bn", "ot", 64], ["x_bn", "ot", 64], ["y_t", "ot", 8], ["x_t", "ot", 8], ["k_split", "ot", 2]]}, "result": [[0.000664516282051282], 0, 0.9440932273864746, 1611866574.783237], "version": 0.2, "tvm_version": "0.8.dev0"}
{"input": ["cuda -keys=cuda,gpu -max_num_threads=1024 -thread_warp_size=32", "logsummul", ["float32"], {}], "config": {"index": 266, "code_hash": null, "entity": [["y_bn", "ot", 128], ["x_bn", "ot", 64], ["y_t", "ot", 64], ["x_t", "ot", 4], ["k_split", "ot", 8]]}, "result": [[0.0004576898392857143], 0, 0.9201955795288086, 1611866575.5555904], "version": 0.2, "tvm_version": "0.8.dev0"}
{"input": ["cuda -keys=cuda,gpu -max_num_threads=1024 -thread_warp_size=32", "logsummul", ["float32"], {}], "config": {"index": 172, "code_hash": null, "entity": [["y_bn", "ot", 64], ["x_bn", "ot", 32], ["y_t", "ot", 32], ["x_t", "ot", 8], ["k_split", "ot", 2]]}, "result": [[0.00032229783018867923], 0, 0.8736653327941895, 1611866576.3005757], "version": 0.2, "tvm_version": "0.8.dev0"}
{"input": ["cuda -keys=cuda,gpu -max_num_threads=1024 -thread_warp_size=32", "logsummul", ["float32"], {}], "config": {"index": 416, "code_hash": null, "entity": [["y_bn", "ot", 128], ["x_bn", "ot", 32], ["y_t", "ot", 32], ["x_t", "ot", 32], ["k_split", "ot", 16]]}, "result": [[0.00027128493229166666], 0, 0.8108954429626465, 1611866576.9768245], "version": 0.2, "tvm_version": "0.8.dev0"}
{"input": ["cuda -keys=cuda,gpu -max_num_threads=1024 -thread_warp_size=32", "logsummul", ["float32"], {}], "config": {"index": 370, "code_hash": null, "entity": [["y_bn", "ot", 64], ["x_bn", "ot", 32], ["y_t", "ot", 64], ["x_t", "ot", 4], ["k_split", "ot", 16]]}, "result": [[0.000652046948051948], 0, 0.9879014492034912, 1611866577.797508], "version": 0.2, "tvm_version": "0.8.dev0"}
{"input": ["cuda -keys=cuda,gpu -max_num_threads=1024 -thread_warp_size=32", "logsummul", ["float32"], {}], "config": {"index": 228, "code_hash": null, "entity": [["y_bn", "ot", 32], ["x_bn", "ot", 64], ["y_t", "ot", 32], ["x_t", "ot", 2], ["k_split", "ot", 8]]}, "result": [[0.00036885592805755395], 0, 0.871192455291748, 1611866578.9253128], "version": 0.2, "tvm_version": "0.8.dev0"}
{"input": ["cuda -keys=cuda,gpu -max_num_threads=1024 -thread_warp_size=32", "logsummul", ["float32"], {}], "config": {"index": 313, "code_hash": null, "entity": [["y_bn", "ot", 64], ["x_bn", "ot", 128], ["y_t", "ot", 32], ["x_t", "ot", 32], ["k_split", "ot", 8]]}, "result": [[0.0009407926835443038], 0, 0.9883754253387451, 1611866579.790041], "version": 0.2, "tvm_version": "0.8.dev0"}
{"input": ["cuda -keys=cuda,gpu -max_num_threads=1024 -thread_warp_size=32", "logsummul", ["float32"], {}], "config": {"index": 265, "code_hash": null, "entity": [["y_bn", "ot", 64], ["x_bn", "ot", 64], ["y_t", "ot", 64], ["x_t", "ot", 4], ["k_split", "ot", 8]]}, "result": [[0.0006089199166666667], 0, 0.8705127239227295, 1611866580.5388908], "version": 0.2, "tvm_version": "0.8.dev0"}
{"input": ["cuda -keys=cuda,gpu -max_num_threads=1024 -thread_warp_size=32", "logsummul", ["float32"], {}], "config": {"index": 355, "code_hash": null, "entity": [["y_bn", "ot", 64], ["x_bn", "ot", 64], ["y_t", "ot", 8], ["x_t", "ot", 4], ["k_split", "ot", 16]]}, "result": [[0.0019498743703703703], 0, 1.1759922504425049, 1611866581.4602675], "version": 0.2, "tvm_version": "0.8.dev0"}
{"input": ["cuda -keys=cuda,gpu -max_num_threads=1024 -thread_warp_size=32", "logsummul", ["float32"], {}], "config": {"index": 411, "code_hash": null, "entity": [["y_bn", "ot", 32], ["x_bn", "ot", 128], ["y_t", "ot", 8], ["x_t", "ot", 32], ["k_split", "ot", 16]]}, "result": [[0.000895067724137931], 0, 0.8898751735687256, 1611866582.8341331], "version": 0.2, "tvm_version": "0.8.dev0"}
{"input": ["cuda -keys=cuda,gpu -max_num_threads=1024 -thread_warp_size=32", "logsummul", ["float32"], {}], "config": {"index": 333, "code_hash": null, "entity": [["y_bn", "ot", 32], ["x_bn", "ot", 32], ["y_t", "ot", 32], ["x_t", "ot", 2], ["k_split", "ot", 16]]}, "result": [[0.00042304876190476186], 0, 1.0418531894683838, 1611866583.7005444], "version": 0.2, "tvm_version": "0.8.dev0"}
{"input": ["cuda -keys=cuda,gpu -max_num_threads=1024 -thread_warp_size=32", "logsummul", ["float32"], {}], "config": {"index": 12, "code_hash": null, "entity": [["y_bn", "ot", 32], ["x_bn", "ot", 64], ["y_t", "ot", 32], ["x_t", "ot", 2], ["k_split", "ot", 1]]}, "result": [[0.000453478701754386], 0, 1.0054621696472168, 1611866584.531752], "version": 0.2, "tvm_version": "0.8.dev0"}
{"input": ["cuda -keys=cuda,gpu -max_num_threads=1024 -thread_warp_size=32", "logsummul", ["float32"], {}], "config": {"index": 6, "code_hash": null, "entity": [["y_bn", "ot", 32], ["x_bn", "ot", 128], ["y_t", "ot", 8], ["x_t", "ot", 2], ["k_split", "ot", 1]]}, "result": [[0.0035784796875], 0, 1.3499267101287842, 1611866585.3797977], "version": 0.2, "tvm_version": "0.8.dev0"}
{"input": ["cuda -keys=cuda,gpu -max_num_threads=1024 -thread_warp_size=32", "logsummul", ["float32"], {}], "config": {"index": 235, "code_hash": null, "entity": [["y_bn", "ot", 64], ["x_bn", "ot", 32], ["y_t", "ot", 64], ["x_t", "ot", 2], ["k_split", "ot", 8]]}, "result": [[0.0003927049202898551], 0, 0.8532354831695557, 1611866586.5196917], "version": 0.2, "tvm_version": "0.8.dev0"}
{"input": ["cuda -keys=cuda,gpu -max_num_threads=1024 -thread_warp_size=32", "logsummul", ["float32"], {}], "config": {"index": 82, "code_hash": null, "entity": [["y_bn", "ot", 64], ["x_bn", "ot", 32], ["y_t", "ot", 8], ["x_t", "ot", 32], ["k_split", "ot", 1]]}, "result": [[0.0006380723209876543], 0, 0.9670543670654297, 1611866587.3290749], "version": 0.2, "tvm_version": "0.8.dev0"}
{"input": ["cuda -keys=cuda,gpu -max_num_threads=1024 -thread_warp_size=32", "logsummul", ["float32"], {}], "config": {"index": 385, "code_hash": null, "entity": [["y_bn", "ot", 64], ["x_bn", "ot", 128], ["y_t", "ot", 8], ["x_t", "ot", 8], ["k_split", "ot", 16]]}, "result": [[0.0019829102692307692], 0, 1.181394100189209, 1611866588.205058], "version": 0.2, "tvm_version": "0.8.dev0"}
{"input": ["cuda -keys=cuda,gpu -max_num_threads=1024 -thread_warp_size=32", "logsummul", ["float32"], {}], "config": {"index": 240, "code_hash": null, "entity": [["y_bn", "ot", 32], ["x_bn", "ot", 128], ["y_t", "ot", 64], ["x_t", "ot", 2], ["k_split", "ot", 8]]}, "result": [[0.001485162], 0, 1.126255989074707, 1611866589.052072], "version": 0.2, "tvm_version": "0.8.dev0"}
{"input": ["cuda -keys=cuda,gpu -max_num_threads=1024 -thread_warp_size=32", "logsummul", ["float32"], {}], "config": {"index": 286, "code_hash": null, "entity": [["y_bn", "ot", 64], ["x_bn", "ot", 128], ["y_t", "ot", 32], ["x_t", "ot", 8], ["k_split", "ot", 8]]}, "result": [[0.0006813757721518987], 0, 0.8347234725952148, 1611866590.3812544], "version": 0.2, "tvm_version": "0.8.dev0"}
{"input": ["cuda -keys=cuda,gpu -max_num_threads=1024 -thread_warp_size=32", "logsummul", ["float32"], {}], "config": {"index": 274, "code_hash": null, "entity": [["y_bn", "ot", 64], ["x_bn", "ot", 64], ["y_t", "ot", 8], ["x_t", "ot", 8], ["k_split", "ot", 8]]}, "result": [[0.0004938594050632912], 0, 1.1690349578857422, 1611866591.3674533], "version": 0.2, "tvm_version": "0.8.dev0"}
{"input": ["cuda -keys=cuda,gpu -max_num_threads=1024 -thread_warp_size=32", "logsummul", ["float32"], {}], "config": {"index": 92, "code_hash": null, "entity": [["y_bn", "ot", 128], ["x_bn", "ot", 32], ["y_t", "ot", 32], ["x_t", "ot", 32], ["k_split", "ot", 1]]}, "result": [[0.0005696781857142856], 0, 0.9621503353118896, 1611866592.1853359], "version": 0.2, "tvm_version": "0.8.dev0"}
{"input": ["cuda -keys=cuda,gpu -max_num_threads=1024 -thread_warp_size=32", "logsummul", ["float32"], {}], "config": {"index": 326, "code_hash": null, "entity": [["y_bn", "ot", 128], ["x_bn", "ot", 32], ["y_t", "ot", 8], ["x_t", "ot", 2], ["k_split", "ot", 16]]}, "result": [[0.009594234699999999], 0, 1.4455702304840088, 1611866593.1696756], "version": 0.2, "tvm_version": "0.8.dev0"}
{"input": ["cuda -keys=cuda,gpu -max_num_threads=1024 -thread_warp_size=32", "logsummul", ["float32"], {}], "config": {"index": 190, "code_hash": null, "entity": [["y_bn", "ot", 64], ["x_bn", "ot", 32], ["y_t", "ot", 8], ["x_t", "ot", 32], ["k_split", "ot", 2]]}, "result": [[0.00039461079000000003], 0, 0.9368605613708496, 1611866594.4706361], "version": 0.2, "tvm_version": "0.8.dev0"}
{"input": ["cuda -keys=cuda,gpu -max_num_threads=1024 -thread_warp_size=32", "logsummul", ["float32"], {}], "config": {"index": 344, "code_hash": null, "entity": [["y_bn", "ot", 128], ["x_bn", "ot", 32], ["y_t", "ot", 64], ["x_t", "ot", 2], ["k_split", "ot", 16]]}, "result": [[0.00046719234545454546], 0, 0.9520900249481201, 1611866595.197906], "version": 0.2, "tvm_version": "0.8.dev0"}
{"input": ["cuda -keys=cuda,gpu -max_num_threads=1024 -thread_warp_size=32", "logsummul", ["float32"], {}], "config": {"index": 71, "code_hash": null, "entity": [["y_bn", "ot", 128], ["x_bn", "ot", 128], ["y_t", "ot", 32], ["x_t", "ot", 8], ["k_split", "ot", 1]]}, "result": [[0.000947193425925926], 0, 1.0173656940460205, 1611866596.0310233], "version": 0.2, "tvm_version": "0.8.dev0"}
{"input": ["cuda -keys=cuda,gpu -max_num_threads=1024 -thread_warp_size=32", "logsummul", ["float32"], {}], "config": {"index": 369, "code_hash": null, "entity": [["y_bn", "ot", 32], ["x_bn", "ot", 32], ["y_t", "ot", 64], ["x_t", "ot", 4], ["k_split", "ot", 16]]}, "result": [[0.0014006550555555556], 0, 0.8750252723693848, 1611866596.733824], "version": 0.2, "tvm_version": "0.8.dev0"}
{"input": ["cuda -keys=cuda,gpu -max_num_threads=1024 -thread_warp_size=32", "logsummul", ["float32"], {}], "config": {"index": 325, "code_hash": null, "entity": [["y_bn", "ot", 64], ["x_bn", "ot", 32], ["y_t", "ot", 8], ["x_t", "ot", 2], ["k_split", "ot", 16]]}, "result": [[0.002038372], 0, 1.1691181659698486, 1611866597.5725965], "version": 0.2, "tvm_version": "0.8.dev0"}
{"input": ["cuda -keys=cuda,gpu -max_num_threads=1024 -thread_warp_size=32", "logsummul", ["float32"], {}], "config": {"index": 18, "code_hash": null, "entity": [["y_bn", "ot", 32], ["x_bn", "ot", 32], ["y_t", "ot", 64], ["x_t", "ot", 2], ["k_split", "ot", 1]]}, "result": [[0.0007439747961165049], 0, 0.9564967155456543, 1611866598.9426405], "version": 0.2, "tvm_version": "0.8.dev0"}
{"input": ["cuda -keys=cuda,gpu -max_num_threads=1024 -thread_warp_size=32", "logsummul", ["float32"], {}], "config": {"index": 51, "code_hash": null, "entity": [["y_bn", "ot", 32], ["x_bn", "ot", 128], ["y_t", "ot", 64], ["x_t", "ot", 4], ["k_split", "ot", 1]]}, "result": [[0.0015343491176470587], 0, 0.8714253902435303, 1611866599.6850786], "version": 0.2, "tvm_version": "0.8.dev0"}
{"input": ["cuda -keys=cuda,gpu -max_num_threads=1024 -thread_warp_size=32", "logsummul", ["float32"], {}], "config": {"index": 409, "code_hash": null, "entity": [["y_bn", "ot", 64], ["x_bn", "ot", 64], ["y_t", "ot", 8], ["x_t", "ot", 32], ["k_split", "ot", 16]]}, "result": [[0.0005318212638888889], 0, 1.012807846069336, 1611866600.5408778], "version": 0.2, "tvm_version": "0.8.dev0"}
{"input": ["cuda -keys=cuda,gpu -max_num_threads=1024 -thread_warp_size=32", "logsummul", ["float32"], {}], "config": {"index": 32, "code_hash": null, "entity": [["y_bn", "ot", 128], ["x_bn", "ot", 64], ["y_t", "ot", 8], ["x_t", "ot", 4], ["k_split", "ot", 1]]}, "result": [[0.0073175182], 0, 1.285090684890747, 1611866601.3922167], "version": 0.2, "tvm_version": "0.8.dev0"}
{"input": ["cuda -keys=cuda,gpu -max_num_threads=1024 -thread_warp_size=32", "logsummul", ["float32"], {}], "config": {"index": 179, "code_hash": null, "entity": [["y_bn", "ot", 128], ["x_bn", "ot", 128], ["y_t", "ot", 32], ["x_t", "ot", 8], ["k_split", "ot", 2]]}, "result": [[0.0011156815217391305], 0, 0.883704662322998, 1611866602.4449453], "version": 0.2, "tvm_version": "0.8.dev0"}
{"input": ["cuda -keys=cuda,gpu -max_num_threads=1024 -thread_warp_size=32", "logsummul", ["float32"], {}], "config": {"index": 13, "code_hash": null, "entity": [["y_bn", "ot", 64], ["x_bn", "ot", 64], ["y_t", "ot", 32], ["x_t", "ot", 2], ["k_split", "ot", 1]]}, "result": [[0.0005536672068965517], 0, 1.0427806377410889, 1611866603.3454492], "version": 0.2, "tvm_version": "0.8.dev0"}
{"input": ["cuda -keys=cuda,gpu -max_num_threads=1024 -thread_warp_size=32", "logsummul", ["float32"], {}], "config": {"index": 126, "code_hash": null, "entity": [["y_bn", "ot", 32], ["x_bn", "ot", 32], ["y_t", "ot", 64], ["x_t", "ot", 2], ["k_split", "ot", 2]]}, "result": [[0.0006065417790697674], 0, 0.907914400100708, 1611866604.1387358], "version": 0.2, "tvm_version": "0.8.dev0"}
{"input": ["cuda -keys=cuda,gpu -max_num_threads=1024 -thread_warp_size=32", "logsummul", ["float32"], {}], "config": {"index": 182, "code_hash": null, "entity": [["y_bn", "ot", 128], ["x_bn", "ot", 32], ["y_t", "ot", 64], ["x_t", "ot", 8], ["k_split", "ot", 2]]}, "result": [[0.00032692066878980893], 0, 0.8565704822540283, 1611866604.8369162], "version": 0.2, "tvm_version": "0.8.dev0"}
{"input": ["cuda -keys=cuda,gpu -max_num_threads=1024 -thread_warp_size=32", "logsummul", ["float32"], {}], "config": {"index": 372, "code_hash": null, "entity": [["y_bn", "ot", 32], ["x_bn", "ot", 64], ["y_t", "ot", 64], ["x_t", "ot", 4], ["k_split", "ot", 16]]}, "result": [[0.001280876275], 0, 0.8621737957000732, 1611866605.9408154], "version": 0.2, "tvm_version": "0.8.dev0"}
{"input": ["cuda -keys=cuda,gpu -max_num_threads=1024 -thread_warp_size=32", "logsummul", ["float32"], {}], "config": {"index": 227, "code_hash": null, "entity": [["y_bn", "ot", 128], ["x_bn", "ot", 32], ["y_t", "ot", 32], ["x_t", "ot", 2], ["k_split", "ot", 8]]}, "result": [[0.0004922871923076923], 0, 1.057309627532959, 1611866606.8102717], "version": 0.2, "tvm_version": "0.8.dev0"}
{"input": ["cuda -keys=cuda,gpu -max_num_threads=1024 -thread_warp_size=32", "logsummul", ["float32"], {}], "config": {"index": 109, "code_hash": null, "entity": [["y_bn", "ot", 64], ["x_bn", "ot", 32], ["y_t", "ot", 8], ["x_t", "ot", 2], ["k_split", "ot", 2]]}, "result": [[0.001965309675], 0, 1.2310130596160889, 1611866607.8060465], "version": 0.2, "tvm_version": "0.8.dev0"}
{"input": ["cuda -keys=cuda,gpu -max_num_threads=1024 -thread_warp_size=32", "logsummul", ["float32"], {}], "config": {"index": 396, "code_hash": null, "entity": [["y_bn", "ot", 32], ["x_bn", "ot", 32], ["y_t", "ot", 64], ["x_t", "ot", 8], ["k_split", "ot", 16]]}, "result": [[0.002457317875], 0, 1.0002365112304688, 1611866608.6609764], "version": 0.2, "tvm_version": "0.8.dev0"}
{"input": ["cuda -keys=cuda,gpu -max_num_threads=1024 -thread_warp_size=32", "logsummul", ["float32"], {}], "config": {"index": 204, "code_hash": null, "entity": [["y_bn", "ot", 32], ["x_bn", "ot", 128], ["y_t", "ot", 32], ["x_t", "ot", 32], ["k_split", "ot", 2]]}, "result": [[0.000560981311827957], 0, 0.8659577369689941, 1611866609.3742952], "version": 0.2, "tvm_version": "0.8.dev0"}
{"input": ["cuda -keys=cuda,gpu -max_num_threads=1024 -thread_warp_size=32", "logsummul", ["float32"], {}], "config": {"index": 137, "code_hash": null, "entity": [["y_bn", "ot", 128], ["x_bn", "ot", 32], ["y_t", "ot", 8], ["x_t", "ot", 4], ["k_split", "ot", 2]]}, "result": [[0.002273012043478261], 0, 1.0464422702789307, 1611866610.7083657], "version": 0.2, "tvm_version": "0.8.dev0"}
{"input": ["cuda -keys=cuda,gpu -max_num_threads=1024 -thread_warp_size=32", "logsummul", ["float32"], {}], "config": {"index": 160, "code_hash": null, "entity": [["y_bn", "ot", 64], ["x_bn", "ot", 128], ["y_t", "ot", 64], ["x_t", "ot", 4], ["k_split", "ot", 2]]}, "result": [[0.0007535026323529412], 0, 0.9422547817230225, 1611866611.456876], "version": 0.2, "tvm_version": "0.8.dev0"}
{"input": ["cuda -keys=cuda,gpu -max_num_threads=1024 -thread_warp_size=32", "logsummul", ["float32"], {}], "config": {"index": 402, "code_hash": null, "entity": [["y_bn", "ot", 32], ["x_bn", "ot", 128], ["y_t", "ot", 64], ["x_t", "ot", 8], ["k_split", "ot", 16]]}, "result": [[0.0023262812424242425], 0, 1.1436641216278076, 1611866612.4126136], "version": 0.2, "tvm_version": "0.8.dev0"}
{"input": ["cuda -keys=cuda,gpu -max_num_threads=1024 -thread_warp_size=32", "logsummul", ["float32"], {}], "config": {"index": 67, "code_hash": null, "entity": [["y_bn", "ot", 64], ["x_bn", "ot", 64], ["y_t", "ot", 32], ["x_t", "ot", 8], ["k_split", "ot", 1]]}, "result": [[0.0003901160203045685], 0, 0.9659192562103271, 1611866613.2420478], "version": 0.2, "tvm_version": "0.8.dev0"}
{"input": ["cuda -keys=cuda,gpu -max_num_threads=1024 -thread_warp_size=32", "logsummul", ["float32"], {}], "config": {"index": 242, "code_hash": null, "entity": [["y_bn", "ot", 128], ["x_bn", "ot", 128], ["y_t", "ot", 64], ["x_t", "ot", 2], ["k_split", "ot", 8]]}, "result": [[0.0025524527500000002], 0, 1.3452222347259521, 1611866614.2677474], "version": 0.2, "tvm_version": "0.8.dev0"}
{"input": ["cuda -keys=cuda,gpu -max_num_threads=1024 -thread_warp_size=32", "logsummul", ["float32"], {}], "config": {"index": 366, "code_hash": null, "entity": [["y_bn", "ot", 32], ["x_bn", "ot", 128], ["y_t", "ot", 32], ["x_t", "ot", 4], ["k_split", "ot", 16]]}, "result": [[0.0006608805125], 0, 0.9095056056976318, 1611866615.4606156], "version": 0.2, "tvm_version": "0.8.dev0"}
{"input": ["cuda -keys=cuda,gpu -max_num_threads=1024 -thread_warp_size=32", "logsummul", ["float32"], {}], "config": {"index": 108, "code_hash": null, "entity": [["y_bn", "ot", 32], ["x_bn", "ot", 32], ["y_t", "ot", 8], ["x_t", "ot", 2], ["k_split", "ot", 2]]}, "result": [[0.0006736217236842104], 0, 0.9580721855163574, 1611866616.7588687], "version": 0.2, "tvm_version": "0.8.dev0"}
{"input": ["cuda -keys=cuda,gpu -max_num_threads=1024 -thread_warp_size=32", "logsummul", ["float32"], {}], "config": {"index": 8, "code_hash": null, "entity": [["y_bn", "ot", 128], ["x_bn", "ot", 128], ["y_t", "ot", 8], ["x_t", "ot", 2], ["k_split", "ot", 1]]}, "result": [[0.019291947], 0, 1.6224236488342285, 1611866618.066359], "version": 0.2, "tvm_version": "0.8.dev0"}
{"input": ["cuda -keys=cuda,gpu -max_num_threads=1024 -thread_warp_size=32", "logsummul", ["float32"], {}], "config": {"index": 217, "code_hash": null, "entity": [["y_bn", "ot", 64], ["x_bn", "ot", 32], ["y_t", "ot", 8], ["x_t", "ot", 2], ["k_split", "ot", 8]]}, "result": [[0.0020252575], 0, 1.0788161754608154, 1611866619.3032153], "version": 0.2, "tvm_version": "0.8.dev0"}
{"input": ["cuda -keys=cuda,gpu -max_num_threads=1024 -thread_warp_size=32", "logsummul", ["float32"], {}], "config": {"index": 87, "code_hash": null, "entity": [["y_bn", "ot", 32], ["x_bn", "ot", 128], ["y_t", "ot", 8], ["x_t", "ot", 32], ["k_split", "ot", 1]]}, "result": [[0.0006151307317073171], 0, 0.8722443580627441, 1611866620.0058796], "version": 0.2, "tvm_version": "0.8.dev0"}
{"input": ["cuda -keys=cuda,gpu -max_num_threads=1024 -thread_warp_size=32", "logsummul", ["float32"], {}], "config": {"index": 168, "code_hash": null, "entity": [["y_bn", "ot", 32], ["x_bn", "ot", 128], ["y_t", "ot", 8], ["x_t", "ot", 8], ["k_split", "ot", 2]]}, "result": [[0.0006565655084745764], 0, 1.1037898063659668, 1611866620.9205134], "version": 0.2, "tvm_version": "0.8.dev0"}
{"input": ["cuda -keys=cuda,gpu -max_num_threads=1024 -thread_warp_size=32", "logsummul", ["float32"], {}], "config": {"index": 88, "code_hash": null, "entity": [["y_bn", "ot", 64], ["x_bn", "ot", 128], ["y_t", "ot", 8], ["x_t", "ot", 32], ["k_split", "ot", 1]]}, "result": [[0.0008028690153846153], 0, 0.9086201190948486, 1611866621.655432], "version": 0.2, "tvm_version": "0.8.dev0"}
{"input": ["cuda -keys=cuda,gpu -max_num_threads=1024 -thread_warp_size=32", "logsummul", ["float32"], {}], "config": {"index": 290, "code_hash": null, "entity": [["y_bn", "ot", 128], ["x_bn", "ot", 32], ["y_t", "ot", 64], ["x_t", "ot", 8], ["k_split", "ot", 8]]}, "result": [[0.0006258980487804877], 0, 0.8141589164733887, 1611866622.6841445], "version": 0.2, "tvm_version": "0.8.dev0"}
{"input": ["cuda -keys=cuda,gpu -max_num_threads=1024 -thread_warp_size=32", "logsummul", ["float32"], {}], "config": {"index": 270, "code_hash": null, "entity": [["y_bn", "ot", 32], ["x_bn", "ot", 32], ["y_t", "ot", 8], ["x_t", "ot", 8], ["k_split", "ot", 8]]}, "result": [[0.0004516160621468926], 0, 1.141850233078003, 1611866623.6199937], "version": 0.2, "tvm_version": "0.8.dev0"}
{"input": ["cuda -keys=cuda,gpu -max_num_threads=1024 -thread_warp_size=32", "logsummul", ["float32"], {}], "config": {"index": 156, "code_hash": null, "entity": [["y_bn", "ot", 32], ["x_bn", "ot", 64], ["y_t", "ot", 64], ["x_t", "ot", 4], ["k_split", "ot", 2]]}, "result": [[0.0013629729487179489], 0, 0.8812775611877441, 1611866624.338304], "version": 0.2, "tvm_version": "0.8.dev0"}
{"input": ["cuda -keys=cuda,gpu -max_num_threads=1024 -thread_warp_size=32", "logsummul", ["float32"], {}], "config": {"index": 422, "code_hash": null, "entity": [["y_bn", "ot", 128], ["x_bn", "ot", 128], ["y_t", "ot", 32], ["x_t", "ot", 32], ["k_split", "ot", 16]]}, "result": [[0.001875259111111111], 0, 0.903148889541626, 1611866625.108268], "version": 0.2, "tvm_version": "0.8.dev0"}
{"input": ["cuda -keys=cuda,gpu -max_num_threads=1024 -thread_warp_size=32", "logsummul", ["float32"], {}], "config": {"index": 241, "code_hash": null, "entity": [["y_bn", "ot", 64], ["x_bn", "ot", 128], ["y_t", "ot", 64], ["x_t", "ot", 2], ["k_split", "ot", 8]]}, "result": [[0.0004703865229357798], 0, 0.9126441478729248, 1611866626.1744514], "version": 0.2, "tvm_version": "0.8.dev0"}
{"input": ["cuda -keys=cuda,gpu -max_num_threads=1024 -thread_warp_size=32", "logsummul", ["float32"], {}], "config": {"index": 176, "code_hash": null, "entity": [["y_bn", "ot", 128], ["x_bn", "ot", 64], ["y_t", "ot", 32], ["x_t", "ot", 8], ["k_split", "ot", 2]]}, "result": [[0.0004864321047619048], 0, 0.911339521408081, 1611866626.9335492], "version": 0.2, "tvm_version": "0.8.dev0"}
{"input": ["cuda -keys=cuda,gpu -max_num_threads=1024 -thread_warp_size=32", "logsummul", ["float32"], {}], "config": {"index": 203, "code_hash": null, "entity": [["y_bn", "ot", 128], ["x_bn", "ot", 64], ["y_t", "ot", 32], ["x_t", "ot", 32], ["k_split", "ot", 2]]}, "result": [[0.000556143623655914], 0, 0.8172369003295898, 1611866627.6150594], "version": 0.2, "tvm_version": "0.8.dev0"}
{"input": ["cuda -keys=cuda,gpu -max_num_threads=1024 -thread_warp_size=32", "logsummul", ["float32"], {}], "config": {"index": 264, "code_hash": null, "entity": [["y_bn", "ot", 32], ["x_bn", "ot", 64], ["y_t", "ot", 64], ["x_t", "ot", 4], ["k_split", "ot", 8]]}, "result": [[0.0012510827619047619], 0, 1.043644905090332, 1611866628.4861622], "version": 0.2, "tvm_version": "0.8.dev0"}
{"input": ["cuda -keys=cuda,gpu -max_num_threads=1024 -thread_warp_size=32", "logsummul", ["float32"], {}], "config": {"index": 360, "code_hash": null, "entity": [["y_bn", "ot", 32], ["x_bn", "ot", 32], ["y_t", "ot", 32], ["x_t", "ot", 4], ["k_split", "ot", 16]]}, "result": [[0.0006645075454545455], 0, 0.9076864719390869, 1611866629.241396], "version": 0.2, "tvm_version": "0.8.dev0"}
{"input": ["cuda -keys=cuda,gpu -max_num_threads=1024 -thread_warp_size=32", "logsummul", ["float32"], {}], "config": {"index": 194, "code_hash": null, "entity": [["y_bn", "ot", 128], ["x_bn", "ot", 64], ["y_t", "ot", 8], ["x_t", "ot", 32], ["k_split", "ot", 2]]}, "result": [[0.0005659306593406593], 0, 0.8289303779602051, 1611866630.5069175], "version": 0.2, "tvm_version": "0.8.dev0"}
{"input": ["cuda -keys=cuda,gpu -max_num_threads=1024 -thread_warp_size=32", "logsummul", ["float32"], {}], "config": {"index": 224, "code_hash": null, "entity": [["y_bn", "ot", 128], ["x_bn", "ot", 128], ["y_t", "ot", 8], ["x_t", "ot", 2], ["k_split", "ot", 8]]}, "result": [[0.0293009069], 0, 1.9513280391693115, 1611866632.088405], "version": 0.2, "tvm_version": "0.8.dev0"}
{"input": ["cuda -keys=cuda,gpu -max_num_threads=1024 -thread_warp_size=32", "logsummul", ["float32"], {}], "config": {"index": 421, "code_hash": null, "entity": [["y_bn", "ot", 64], ["x_bn", "ot", 128], ["y_t", "ot", 32], ["x_t", "ot", 32], ["k_split", "ot", 16]]}, "result": [[0.0009571536896551724], 0, 1.02754807472229, 1611866632.9618099], "version": 0.2, "tvm_version": "0.8.dev0"}
{"input": ["cuda -keys=cuda,gpu -max_num_threads=1024 -thread_warp_size=32", "logsummul", ["float32"], {}], "config": {"index": 278, "code_hash": null, "entity": [["y_bn", "ot", 128], ["x_bn", "ot", 128], ["y_t", "ot", 8], ["x_t", "ot", 8], ["k_split", "ot", 8]]}, "result": [[0.007389586300000001], 0, 1.2986845970153809, 1611866633.808249], "version": 0.2, "tvm_version": "0.8.dev0"}
{"input": ["cuda -keys=cuda,gpu -max_num_threads=1024 -thread_warp_size=32", "logsummul", ["float32"], {}], "config": {"index": 310, "code_hash": null, "entity": [["y_bn", "ot", 64], ["x_bn", "ot", 64], ["y_t", "ot", 32], ["x_t", "ot", 32], ["k_split", "ot", 8]]}, "result": [[0.0003707912857142857], 0, 0.8015096187591553, 1611866634.865502], "version": 0.2, "tvm_version": "0.8.dev0"}
{"input": ["cuda -keys=cuda,gpu -max_num_threads=1024 -thread_warp_size=32", "logsummul", ["float32"], {}], "config": {"index": 352, "code_hash": null, "entity": [["y_bn", "ot", 64], ["x_bn", "ot", 32], ["y_t", "ot", 8], ["x_t", "ot", 4], ["k_split", "ot", 16]]}, "result": [[0.000453383226993865], 0, 1.1475443840026855, 1611866635.8306825], "version": 0.2, "tvm_version": "0.8.dev0"}
{"input": ["cuda -keys=cuda,gpu -max_num_threads=1024 -thread_warp_size=32", "logsummul", ["float32"], {}], "config": {"index": 132, "code_hash": null, "entity": [["y_bn", "ot", 32], ["x_bn", "ot", 128], ["y_t", "ot", 64], ["x_t", "ot", 2], ["k_split", "ot", 2]]}, "result": [[0.00200395888], 0, 1.0473048686981201, 1611866636.6792254], "version": 0.2, "tvm_version": "0.8.dev0"}
{"input": ["cuda -keys=cuda,gpu -max_num_threads=1024 -thread_warp_size=32", "logsummul", ["float32"], {}], "config": {"index": 159, "code_hash": null, "entity": [["y_bn", "ot", 32], ["x_bn", "ot", 128], ["y_t", "ot", 64], ["x_t", "ot", 4], ["k_split", "ot", 2]]}, "result": [[0.0015752216666666669], 0, 0.9908614158630371, 1611866637.5488837], "version": 0.2, "tvm_version": "0.8.dev0"}
{"input": ["cuda -keys=cuda,gpu -max_num_threads=1024 -thread_warp_size=32", "logsummul", ["float32"], {}], "config": {"index": 237, "code_hash": null, "entity": [["y_bn", "ot", 32], ["x_bn", "ot", 64], ["y_t", "ot", 64], ["x_t", "ot", 2], ["k_split", "ot", 8]]}, "result": [[0.0008448066021505377], 0, 1.0213513374328613, 1611866638.406161], "version": 0.2, "tvm_version": "0.8.dev0"}
{"input": ["cuda -keys=cuda,gpu -max_num_threads=1024 -thread_warp_size=32", "logsummul", ["float32"], {}], "config": {"index": 120, "code_hash": null, "entity": [["y_bn", "ot", 32], ["x_bn", "ot", 64], ["y_t", "ot", 32], ["x_t", "ot", 2], ["k_split", "ot", 2]]}, "result": [[0.00034784231972789114], 0, 0.8551938533782959, 1611866639.6973698], "version": 0.2, "tvm_version": "0.8.dev0"}
{"input": ["cuda -keys=cuda,gpu -max_num_threads=1024 -thread_warp_size=32", "logsummul", ["float32"], {}], "config": {"index": 359, "code_hash": null, "entity": [["y_bn", "ot", 128], ["x_bn", "ot", 128], ["y_t", "ot", 8], ["x_t", "ot", 4], ["k_split", "ot", 16]]}, "result": [[0.0161788841], 0, 1.5907361507415771, 1611866640.8399634], "version": 0.2, "tvm_version": "0.8.dev0"}
{"input": ["cuda -keys=cuda,gpu -max_num_threads=1024 -thread_warp_size=32", "logsummul", ["float32"], {}], "config": {"index": 299, "code_hash": null, "entity": [["y_bn", "ot", 128], ["x_bn", "ot", 32], ["y_t", "ot", 8], ["x_t", "ot", 32], ["k_split", "ot", 8]]}, "result": [[0.00031875042063492064], 0, 1.119403600692749, 1611866641.8111303], "version": 0.2, "tvm_version": "0.8.dev0"}
{"input": ["cuda -keys=cuda,gpu -max_num_threads=1024 -thread_warp_size=32", "logsummul", ["float32"], {}], "config": {"index": 161, "code_hash": null, "entity": [["y_bn", "ot", 128], ["x_bn", "ot", 128], ["y_t", "ot", 64], ["x_t", "ot", 4], ["k_split", "ot", 2]]}, "result": [[0.000945226037037037], 0, 0.9078588485717773, 1611866643.2559652], "version": 0.2, "tvm_version": "0.8.dev0"}
{"input": ["cuda -keys=cuda,gpu -max_num_threads=1024 -thread_warp_size=32", "logsummul", ["float32"], {}], "config": {"index": 354, "code_hash": null, "entity": [["y_bn", "ot", 32], ["x_bn", "ot", 64], ["y_t", "ot", 8], ["x_t", "ot", 4], ["k_split", "ot", 16]]}, "result": [[0.0004699321559633027], 0, 1.0977389812469482, 1611866644.1525187], "version": 0.2, "tvm_version": "0.8.dev0"}
{"input": ["cuda -keys=cuda,gpu -max_num_threads=1024 -thread_warp_size=32", "logsummul", ["float32"], {}], "config": {"index": 150, "code_hash": null, "entity": [["y_bn", "ot", 32], ["x_bn", "ot", 128], ["y_t", "ot", 32], ["x_t", "ot", 4], ["k_split", "ot", 2]]}, "result": [[0.0007115089305555555], 0, 0.9489548206329346, 1611866644.9569921], "version": 0.2, "tvm_version": "0.8.dev0"}
{"input": ["cuda -keys=cuda,gpu -max_num_threads=1024 -thread_warp_size=32", "logsummul", ["float32"], {}], "config": {"index": 222, "code_hash": null, "entity": [["y_bn", "ot", 32], ["x_bn", "ot", 128], ["y_t", "ot", 8], ["x_t", "ot", 2], ["k_split", "ot", 8]]}, "result": [[0.0078790283], 0, 1.448117733001709, 1611866645.8593562], "version": 0.2, "tvm_version": "0.8.dev0"}
{"input": ["cuda -keys=cuda,gpu -max_num_threads=1024 -thread_warp_size=32", "logsummul", ["float32"], {}], "config": {"index": 376, "code_hash": null, "entity": [["y_bn", "ot", 64], ["x_bn", "ot", 128], ["y_t", "ot", 64], ["x_t", "ot", 4], ["k_split", "ot", 16]]}, "result": [[0.0006822463333333333], 0, 1.0381360054016113, 1611866646.750555], "version": 0.2, "tvm_version": "0.8.dev0"}
{"input": ["cuda -keys=cuda,gpu -max_num_threads=1024 -thread_warp_size=32", "logsummul", ["float32"], {}], "config": {"index": 192, "code_hash": null, "entity": [["y_bn", "ot", 32], ["x_bn", "ot", 64], ["y_t", "ot", 8], ["x_t", "ot", 32], ["k_split", "ot", 2]]}, "result": [[0.00044619982608695653], 0, 0.9572639465332031, 1611866647.8939216], "version": 0.2, "tvm_version": "0.8.dev0"}
{"input": ["cuda -keys=cuda,gpu -max_num_threads=1024 -thread_warp_size=32", "logsummul", ["float32"], {}], "config": {"index": 151, "code_hash": null, "entity": [["y_bn", "ot", 64], ["x_bn", "ot", 128], ["y_t", "ot", 32], ["x_t", "ot", 4], ["k_split", "ot", 2]]}, "result": [[0.000596897380952381], 0, 1.0169827938079834, 1611866648.7229211], "version": 0.2, "tvm_version": "0.8.dev0"}
{"input": ["cuda -keys=cuda,gpu -max_num_threads=1024 -thread_warp_size=32", "logsummul", ["float32"], {}], "config": {"index": 129, "code_hash": null, "entity": [["y_bn", "ot", 32], ["x_bn", "ot", 64], ["y_t", "ot", 64], ["x_t", "ot", 2], ["k_split", "ot", 2]]}, "result": [[0.0008844626440677965], 0, 0.8788883686065674, 1611866649.4630048], "version": 0.2, "tvm_version": "0.8.dev0"}
{"input": ["cuda -keys=cuda,gpu -max_num_threads=1024 -thread_warp_size=32", "logsummul", ["float32"], {}], "config": {"index": 11, "code_hash": null, "entity": [["y_bn", "ot", 128], ["x_bn", "ot", 32], ["y_t", "ot", 32], ["x_t", "ot", 2], ["k_split", "ot", 1]]}, "result": [[0.0005774056771653543], 0, 0.9910690784454346, 1611866650.2818909], "version": 0.2, "tvm_version": "0.8.dev0"}
{"input": ["cuda -keys=cuda,gpu -max_num_threads=1024 -thread_warp_size=32", "logsummul", ["float32"], {}], "config": {"index": 39, "code_hash": null, "entity": [["y_bn", "ot", 32], ["x_bn", "ot", 64], ["y_t", "ot", 32], ["x_t", "ot", 4], ["k_split", "ot", 1]]}, "result": [[0.0005586581847826087], 0, 0.83669114112854, 1611866650.9877791], "version": 0.2, "tvm_version": "0.8.dev0"}
{"input": ["cuda -keys=cuda,gpu -max_num_threads=1024 -thread_warp_size=32", "logsummul", ["float32"], {}], "config": {"index": 177, "code_hash": null, "entity": [["y_bn", "ot", 32], ["x_bn", "ot", 128], ["y_t", "ot", 32], ["x_t", "ot", 8], ["k_split", "ot", 2]]}, "result": [[0.001282763375], 0, 0.8613598346710205, 1611866652.2841063], "version": 0.2, "tvm_version": "0.8.dev0"}
{"input": ["cuda -keys=cuda,gpu -max_num_threads=1024 -thread_warp_size=32", "logsummul", ["float32"], {}], "config": {"index": 31, "code_hash": null, "entity": [["y_bn", "ot", 64], ["x_bn", "ot", 64], ["y_t", "ot", 8], ["x_t", "ot", 4], ["k_split", "ot", 1]]}, "result": [[0.00200247972], 0, 1.1125833988189697, 1611866653.1915567], "version": 0.2, "tvm_version": "0.8.dev0"}
{"input": ["cuda -keys=cuda,gpu -max_num_threads=1024 -thread_warp_size=32", "logsummul", ["float32"], {}], "config": {"index": 221, "code_hash": null, "entity": [["y_bn", "ot", 128], ["x_bn", "ot", 64], ["y_t", "ot", 8], ["x_t", "ot", 2], ["k_split", "ot", 8]]}, "result": [[0.017693792], 0, 1.6215970516204834, 1611866654.3551414], "version": 0.2, "tvm_version": "0.8.dev0"}
{"input": ["cuda -keys=cuda,gpu -max_num_threads=1024 -thread_warp_size=32", "logsummul", ["float32"], {}], "config": {"index": 303, "code_hash": null, "entity": [["y_bn", "ot", 32], ["x_bn", "ot", 128], ["y_t", "ot", 8], ["x_t", "ot", 32], ["k_split", "ot", 8]]}, "result": [[0.0009407211636363636], 0, 0.9619350433349609, 1611866655.1595132], "version": 0.2, "tvm_version": "0.8.dev0"}
{"input": ["cuda -keys=cuda,gpu -max_num_threads=1024 -thread_warp_size=32", "logsummul", ["float32"], {}], "config": {"index": 155, "code_hash": null, "entity": [["y_bn", "ot", 128], ["x_bn", "ot", 32], ["y_t", "ot", 64], ["x_t", "ot", 4], ["k_split", "ot", 2]]}, "result": [[0.0003333929090909091], 0, 0.850759744644165, 1611866655.869189], "version": 0.2, "tvm_version": "0.8.dev0"}
{"input": ["cuda -keys=cuda,gpu -max_num_threads=1024 -thread_warp_size=32", "logsummul", [512, 256, 262144, "float32"], {}], "config": {"index": 299, "code_hash": null, "entity": [["y_bn", "ot", 128], ["x_bn", "ot", 32], ["y_t", "ot", 8], ["x_t", "ot", 32], ["k_split", "ot", 8]]}, "result": [[0.0651986156, 0.059178003], 0, 23.523587226867676, 1611869357.098135], "version": 0.2, "tvm_version": "0.8.dev0"}
{"input": ["cuda -keys=cuda,gpu -max_num_threads=1024 -thread_warp_size=32", "logsummul", [512, 256, 262144, "float32"], {}], "config": {"index": 344, "code_hash": null, "entity": [["y_bn", "ot", 128], ["x_bn", "ot", 32], ["y_t", "ot", 64], ["x_t", "ot", 2], ["k_split", "ot", 16]]}, "result": [[0.1052937052, 0.10035877580000001], 0, 24.22424578666687, 1611869381.149034], "version": 0.2, "tvm_version": "0.8.dev0"}
{"input": ["cuda -keys=cuda,gpu -max_num_threads=1024 -thread_warp_size=32", "logsummul", [512, 256, 262144, "float32"], {}], "config": {"index": 188, "code_hash": null, "entity": [["y_bn", "ot", 128], ["x_bn", "ot", 128], ["y_t", "ot", 64], ["x_t", "ot", 8], ["k_split", "ot", 2]]}, "result": [[0.1569086102, 0.1562004872], 0, 24.904703855514526, 1611869405.8959455], "version": 0.2, "tvm_version": "0.8.dev0"}
{"input": ["cuda -keys=cuda,gpu -max_num_threads=1024 -thread_warp_size=32", "logsummul", [512, 256, 262144, "float32"], {}], "config": {"index": 186, "code_hash": null, "entity": [["y_bn", "ot", 32], ["x_bn", "ot", 128], ["y_t", "ot", 64], ["x_t", "ot", 8], ["k_split", "ot", 2]]}, "result": [[0.6140947124, 0.6543700109999999], 0, 30.01374888420105, 1611869436.1269982], "version": 0.2, "tvm_version": "0.8.dev0"}
{"input": ["cuda -keys=cuda,gpu -max_num_threads=1024 -thread_warp_size=32", "logsummul", [512, 256, 262144, "float32"], {}], "config": {"index": 279, "code_hash": null, "entity": [["y_bn", "ot", 32], ["x_bn", "ot", 32], ["y_t", "ot", 32], ["x_t", "ot", 8], ["k_split", "ot", 8]]}, "result": [[0.32147315060000003, 0.3231380914], 0, 26.44058108329773, 1611869462.4151785], "version": 0.2, "tvm_version": "0.8.dev0"}
{"input": ["cuda -keys=cuda,gpu -max_num_threads=1024 -thread_warp_size=32", "logsummul", [512, 256, 262144, "float32"], {}], "config": {"index": 231, "code_hash": null, "entity": [["y_bn", "ot", 32], ["x_bn", "ot", 128], ["y_t", "ot", 32], ["x_t", "ot", 2], ["k_split", "ot", 8]]}, "result": [[0.0952150246, 0.0881575628], 0, 24.406776428222656, 1611869486.653942], "version": 0.2, "tvm_version": "0.8.dev0"}
{"input": ["cuda -keys=cuda,gpu -max_num_threads=1024 -thread_warp_size=32", "logsummul", [512, 256, 262144, "float32"], {}], "config": {"index": 361, "code_hash": null, "entity": [["y_bn", "ot", 64], ["x_bn", "ot", 32], ["y_t", "ot", 32], ["x_t", "ot", 4], ["k_split", "ot", 16]]}, "result": [[0.1139449968, 0.1140490174], 0, 24.361637115478516, 1611869510.863688], "version": 0.2, "tvm_version": "0.8.dev0"}
{"input": ["cuda -keys=cuda,gpu -max_num_threads=1024 -thread_warp_size=32", "logsummul", [262144, 512, 256, "float32"], {}], "config": {"index": 77, "code_hash": null, "entity": [["y_bn", "ot", 128], ["x_bn", "ot", 64], ["y_t", "ot", 64], ["x_t", "ot", 8], ["k_split", "ot", 1]]}, "result": [[0.08619920319999999, 0.0828777646], 0, 32.12393307685852, 1611949811.546785], "version": 0.2, "tvm_version": "0.8.dev0"}
{"input": ["cuda -keys=cuda,gpu -max_num_threads=1024 -thread_warp_size=32", "logsummul", [262144, 512, 256, "float32"], {}], "config": {"index": 94, "code_hash": null, "entity": [["y_bn", "ot", 64], ["x_bn", "ot", 64], ["y_t", "ot", 32], ["x_t", "ot", 32], ["k_split", "ot", 1]]}, "result": [[0.1397760562, 0.1346791944], 0, 32.84921669960022, 1611949844.2784429], "version": 0.2, "tvm_version": "0.8.dev0"}
{"input": ["cuda -keys=cuda,gpu -max_num_threads=1024 -thread_warp_size=32", "logsummul", [262144, 512, 256, "float32"], {}], "config": {"index": 344, "code_hash": null, "entity": [["y_bn", "ot", 128], ["x_bn", "ot", 32], ["y_t", "ot", 64], ["x_t", "ot", 2], ["k_split", "ot", 16]]}, "result": [[1.619075916, 1.5252319723999999], 0, 48.64454436302185, 1611949892.7165108], "version": 0.2, "tvm_version": "0.8.dev0"}
{"input": ["cuda -keys=cuda,gpu -max_num_threads=1024 -thread_warp_size=32", "logsummul", [262144, 512, 256, "float32"], {}], "config": {"index": 297, "code_hash": null, "entity": [["y_bn", "ot", 32], ["x_bn", "ot", 32], ["y_t", "ot", 8], ["x_t", "ot", 32], ["k_split", "ot", 8]]}, "result": [[0.06217442520000001, 0.0606423964], 0, 29.62274169921875, 1611949948.1105533], "version": 0.2, "tvm_version": "0.8.dev0"}
{"input": ["cuda -keys=cuda,gpu -max_num_threads=1024 -thread_warp_size=32", "logsummul", [262144, 512, 256, "float32"], {}], "config": {"index": 165, "code_hash": null, "entity": [["y_bn", "ot", 32], ["x_bn", "ot", 64], ["y_t", "ot", 8], ["x_t", "ot", 8], ["k_split", "ot", 2]]}, "result": [[0.5716414914, 0.575092183], 0, 35.40057730674744, 1611949983.356261], "version": 0.2, "tvm_version": "0.8.dev0"}
{"input": ["cuda -keys=cuda,gpu -max_num_threads=1024 -thread_warp_size=32", "logsummul", [262144, 512, 256, "float32"], {}], "config": {"index": 197, "code_hash": null, "entity": [["y_bn", "ot", 128], ["x_bn", "ot", 128], ["y_t", "ot", 8], ["x_t", "ot", 32], ["k_split", "ot", 2]]}, "result": [[0.290909528, 0.2917446618], 0, 32.290546894073486, 1611950015.3903284], "version": 0.2, "tvm_version": "0.8.dev0"}
{"input": ["cuda -keys=cuda,gpu -max_num_threads=1024 -thread_warp_size=32", "logsummul", [262144, 512, 256, "float32"], {}], "config": {"index": 273, "code_hash": null, "entity": [["y_bn", "ot", 32], ["x_bn", "ot", 64], ["y_t", "ot", 8], ["x_t", "ot", 8], ["k_split", "ot", 8]]}, "result": [[0.0982453838, 0.0931680052], 0, 30.26404643058777, 1611950045.4921677], "version": 0.2, "tvm_version": "0.8.dev0"}
{"input": ["cuda -keys=cuda,gpu -max_num_threads=1024 -thread_warp_size=32", "logsummul", [262144, 512, 256, "float32"], {}], "config": {"index": 384, "code_hash": null, "entity": [["y_bn", "ot", 32], ["x_bn", "ot", 128], ["y_t", "ot", 8], ["x_t", "ot", 8], ["k_split", "ot", 16]]}, "result": [[0.9568552466, 0.9591203545999999], 0, 39.87486934661865, 1611950085.0960963], "version": 0.2, "tvm_version": "0.8.dev0"}
{"input": ["cuda -keys=cuda,gpu -max_num_threads=1024 -thread_warp_size=32", "logsummulback", [262144, 512, 256, "float32"], {}], "config": {"index": 310, "code_hash": null, "entity": [["y_bn", "ot", 64], ["x_bn", "ot", 64], ["y_t", "ot", 32], ["x_t", "ot", 32], ["k_split", "ot", 8]]}, "result": [[0.22732424299999998, 0.2268551622], 0, 37.71592593193054, 1611950123.757125], "version": 0.2, "tvm_version": "0.8.dev0"}
{"input": ["cuda -keys=cuda,gpu -max_num_threads=1024 -thread_warp_size=32", "logsummulback", [262144, 512, 256, "float32"], {}], "config": {"index": 183, "code_hash": null, "entity": [["y_bn", "ot", 32], ["x_bn", "ot", 64], ["y_t", "ot", 64], ["x_t", "ot", 8], ["k_split", "ot", 2]]}, "result": [[1.1057151696, 1.1128893806], 0, 47.35291504859924, 1611950291.862505], "version": 0.2, "tvm_version": "0.8.dev0"}
{"input": ["cuda -keys=cuda,gpu -max_num_threads=1024 -thread_warp_size=32", "logsummulback", [262144, 512, 256, "float32"], {}], "config": {"index": 280, "code_hash": null, "entity": [["y_bn", "ot", 64], ["x_bn", "ot", 32], ["y_t", "ot", 32], ["x_t", "ot", 8], ["k_split", "ot", 8]]}, "result": [[0.2557141572, 0.2560646234], 0, 37.97151160240173, 1611950390.6722302], "version": 0.2, "tvm_version": "0.8.dev0"}
{"input": ["cuda -keys=cuda,gpu -max_num_threads=1024 -thread_warp_size=32", "logsummulback", [262144, 512, 256, "float32"], {}], "config": {"index": 216, "code_hash": null, "entity": [["y_bn", "ot", 32], ["x_bn", "ot", 32], ["y_t", "ot", 8], ["x_t", "ot", 2], ["k_split", "ot", 8]]}, "result": [[2.0316772392, 2.0327531542], 0, 57.7877471446991, 1611950448.1630495], "version": 0.2, "tvm_version": "0.8.dev0"}
{"input": ["cuda -keys=cuda,gpu -max_num_threads=1024 -thread_warp_size=32", "logsummulback", [262144, 512, 256, "float32"], {}], "config": {"index": 175, "code_hash": null, "entity": [["y_bn", "ot", 64], ["x_bn", "ot", 64], ["y_t", "ot", 32], ["x_t", "ot", 8], ["k_split", "ot", 2]]}, "result": [[0.5541480094, 0.5540912716], 0, 41.23073434829712, 1611950549.6922622], "version": 0.2, "tvm_version": "0.8.dev0"}
